{
  "$schema": "https://json-schema.org/draft/2020-12/schema",
  "$id": "https://github.com/Pallando-wow/wow-development-data/catalog.schema.json",
  "title": "Pallando WoW Development Data Catalog",
  "type": "object",
  "additionalProperties": false,
  "required": ["schemaVersion", "generatedAt", "clients", "datasets"],
  "properties": {
    "schemaVersion": {
      "type": "integer",
      "const": 1
    },
    "generatedAt": {
      "type": "string",
      "format": "date-time"
    },
    "clients": {
      "type": "array",
      "items": { "$ref": "#/$defs/client" }
    },
    "datasets": {
      "type": "array",
      "items": { "$ref": "#/$defs/dataset" }
    }
  },
  "$defs": {
    "source": {
      "type": "object",
      "additionalProperties": false,
      "required": ["type", "provider", "observedAt"],
      "properties": {
        "type": { "type": "string", "minLength": 1 },
        "provider": { "type": "string", "minLength": 1 },
        "reference": { "type": ["string", "null"] },
        "observedAt": { "type": "string", "format": "date-time" }
      }
    },
    "client": {
      "type": "object",
      "additionalProperties": false,
      "required": ["id", "name", "version", "build", "interface", "source"],
      "properties": {
        "id": { "type": "string", "pattern": "^[a-z0-9_]+$" },
        "name": { "type": "string", "minLength": 1 },
        "version": { "type": "string", "pattern": "^[0-9]+\\.[0-9]+\\.[0-9]+$" },
        "build": { "type": "integer", "minimum": 1 },
        "interface": { "type": "integer", "minimum": 1 },
        "source": { "$ref": "#/$defs/source" }
      }
    },
    "dataset": {
      "type": "object",
      "additionalProperties": false,
      "required": ["id", "clientId", "kind", "path", "schemaVersion", "recordCount", "generatedAt"],
      "properties": {
        "id": { "type": "string", "pattern": "^[a-z0-9_.-]+$" },
        "clientId": { "type": "string", "pattern": "^[a-z0-9_]+$" },
        "kind": { "type": "string", "minLength": 1 },
        "path": { "type": "string", "minLength": 1 },
        "schemaVersion": { "type": "integer", "minimum": 1 },
        "recordCount": { "type": "integer", "minimum": 0 },
        "generatedAt": { "type": "string", "format": "date-time" }
      }
    }
  }
}
