{
  "schemaVersion": 1,
  "generatedAt": "2026-10-17T09:23:27Z",
  "clients": [
    {
      "id": "wow_forever",
      "name": "WoW Forever",
      "version": "1.60.1",
      "build": 70450,
      "interface": 16001,
      "source": {
        "type": "upstream-derived",
        "provider": "Gethe/wow-ui-source",
        "reference": "forever@172a387e3ab85b26e6640d3058d5ec1e6ccd4c63",
        "observedAt": "2026-10-16T22:31:27Z"
      }
    },
    {
      "id": "classic_era",
      "name": "WoW Classic Era",
      "version": "1.15.9",
      "build": 70003,
      "interface": 11509,
      "source": {
        "type": "upstream-derived",
        "provider": "Gethe/wow-ui-source",
        "reference": "classic_era@8165d4cd6e48d606369336cc3a7977902310e81e",
        "observedAt": "2026-09-29T14:16:02Z"
      }
    },
    {
      "id": "classic_anniversary",
      "name": "WoW Classic Anniversary",
      "version": "2.5.6",
      "build": 70006,
      "interface": 20506,
      "source": {
        "type": "upstream-derived",
        "provider": "Gethe/wow-ui-source",
        "reference": "classic_anniversary@2cfec7c00f0f24762d5ca35a4beb1e93c0cde328",
        "observedAt": "2026-10-12T20:46:20Z"
      }
    },
    {
      "id": "mists_classic",
      "name": "WoW Mists of Pandaria Classic",
      "version": "5.5.4",
      "build": 70449,
      "interface": 50504,
      "source": {
        "type": "upstream-derived",
        "provider": "Gethe/wow-ui-source",
        "reference": "classic@72cd28b019e536e9d2e82f036394ec10856d28a1",
        "observedAt": "2026-10-16T22:31:13Z"
      }
    },
    {
      "id": "classic_titan",
      "name": "WoW Titan Reforged",
      "version": "3.80.2",
      "build": 70372,
      "interface": 38002,
      "source": {
        "type": "upstream-derived",
        "provider": "Gethe/wow-ui-source",
        "reference": "classic_titan@65729e5e6fee59b5ced83eb7f9120e1e412ea2a7",
        "observedAt": "2026-10-16T22:45:54Z"
      }
    },
    {
      "id": "retail",
      "name": "World of Warcraft",
      "version": "12.1.5",
      "build": 70448,
      "interface": 120105,
      "source": {
        "type": "upstream-derived",
        "provider": "Gethe/wow-ui-source",
        "reference": "live@b9be9379719047977fca4dba1bb1d9988e8840b3",
        "observedAt": "2026-10-16T23:16:10Z"
      }
    }
  ],
  "datasets": []
}
